{
  "version": 1,
  "detection_batch_sha256": "d6164a95c617d0f698cd003328cd85d8e5cae4402950b848e2605c52a33c2a6b",
  "review_sha256": "c1624221892d552f8aae7f5b7802e9cca35d02ebfed5efe943080c5679105920",
  "prediction_sha256": "43f7a0cb4104ad23adf6b224c042551244f64efdd1729e1d4cc28c86f3dae34b",
  "tracker_adapter": "iou_tracker_v1",
  "tracker_revision": "greedy_iou_v1",
  "tracker_config_sha256": "37053d883864b145e413f7653c71ab35843080b626b1510e313ee01699df9004",
  "runtime_id": "python_stdlib",
  "evidence_status": "association_metrics_available",
  "frame_count": 2,
  "detection_count": 4,
  "eligible_assignment_count": 4,
  "duplicate_detection_count": 0,
  "false_positive_detection_count": 0,
  "unreviewable_detection_count": 0,
  "ground_truth_subject_count": 2,
  "subjects_with_links": 2,
  "predicted_track_count": 2,
  "fragmented_subject_count": 0,
  "fragment_excess_count": 0,
  "fragmentation_rate": 0.0,
  "eligible_link_count": 2,
  "id_switch_count": 0,
  "id_switch_rate": 0.0,
  "continuous_link_count": 2,
  "continuous_id_switch_count": 0,
  "recovery_link_count": 0,
  "recovery_id_switch_count": 0,
  "merged_predicted_track_count": 0,
  "reviewer_count": 1,
  "ground_truth_provenance": "local_human_review",
  "scope": "association_on_detector_boxes",
  "human_ground_truth": true,
  "detection_accuracy_evaluated": false,
  "missed_detections_evaluated": false,
  "subject_identity_inference": false,
  "age_role_inference": false,
  "source_media_included": false,
  "paths_disclosed": false
}
